author,title,publisher,keyword,abs,publish_year
"Feldmann, Louise Mort",Small business development centers and libraries: a survey,REFERENCE SERVICES REVIEW,Academic libraries; Public libraries; Business librarians; Entrepreneurs; SBDC; Small business development center,Purpose - The purpose of this study is to investigate how small business development centers (SBDCs) are working with libraries and librarians to provide assistance to entrepreneurs. Design/methodology/approach - An online survey was distributed to SBDC offices in the mountain west region of the USA to discover if and how they are working with local public and academic libraries and librarians to provide information and services to entrepreneurs. Findings - Surveys were sent to 72 SBDCs with 31 responding (43 per cent). A total of 48 per cent indicated collaborating with public libraries and 36 per cent work with academic libraries. Resources and services provided by librarians and libraries are consistent with the reporting in case study literature. Responses to successes and issues with these arrangements indicate areas for improvement and consideration in collaborations. Research limitations/implications - This research was limited to findings from SBDC offices in the mountain west region. A national survey of efforts might provide more comprehensive results. Future research into whether these partnerships are worthwhile and benefit entrepreneurs and the local economy would be beneficial. Practical implications - The findings indicate areas in which improvements in collaborations could be made in communication and expectations. Social implications - This research might inform future collaborations as communities explore economic development and support of local entrepreneurs. Originality/value - This research provides the unique perspective of non-librarians about these working relationships with librarians. The findings may be useful to improving existing collaborations and in consideration of future partnerships.,2015
"Streatfield, David; Abisla, Richard; Al, Umut; Bunescu, Violeta; Dewata, Yulianto; Garroux, Camila; Greeb, Daniela; Maister, Artiom; Paley, Jeremy; Sharma, Shipra; Sharma, Tripti; Soydal, Irem; Tam Thi Thanh Tran",Global Libraries impact planning and assessment progress: part 2,PERFORMANCE MEASUREMENT AND METRICS,Performance measurement; Impact assessment; Evaluation; Public libraries; Global Libraries Initiative; Impact evaluation,"Purpose The purpose of this paper is to report on recent performance measurement and impact evaluation progress made in Brazil, India, Indonesia, Moldova, Turkey and Vietnam as part of the last phase of the Global Libraries Initiative. Design/methodology/approach The country reports are presented as a series of case studies, in some cases supplementing those reported earlier in this journal. Findings Recent country-specific survey findings are reported and some conclusions are offered. Social implications The paper shows how focusing on the impact of public library services on users can enhance the understanding of community requirements and inform the development of more effective services to library users and communities. Originality/value These case studies reflect concentrated impact evaluation and performance measurement work at country level across a range of countries over more than 18 years.",2019
"Massis, Bruce E.",The business of the library is service,INFORMATION AND LEARNING SCIENCE,Libraries; Public; Business; Loss; Staff; Bonus; Profits,"Purpose - The purpose of this paper is to suggest that today's libraries function using business practices in its management of the library to ensure that its service-based mission is respected. Design/methodology/approach - Literature review and commentary on this topic that has been addressed by professionals, researchers and practitioners. Findings - Libraries have learned from business the importance of using not only the business practice of using a vigorous level of data-driven decision-making, but data-driven reporting as well to a public that expects a higher level of scrutiny, clarity and precision. Paired with evidence from those who have benefitted from the library's programs and services most visibly, this combination of data and human-driven anecdotes can serve as the optimum marriage of business and service-based confirmation of library success. Originality/value - The value in exploring this topic is to make the distinction between libraries whose supporters expect it to be formally managed like a business as opposed to those who suggest that business practices be used in library operations to ensure its mission as a service-based entity is maintained.",2017
"Houston, George W.",Tiberius and the libraries: Public book collections and library buildings in the early Roman empire,LIBRARIES & THE CULTURAL RECORD,,"The principate of the emperor Tiberius was a surprisingly interesting period in Roman library history. Devoted to books and scholarship himself, Tiberius built what must have been a very large new library, but he also confirmed the Augustan principle of constructing numerous separate structures rather than one comprehensive library. He invented the position of library commissioner, to which he appointed a scholarly advisor, not an administrator. He gave texts of three Greek authors to the libraries. This implies that those works had not previously been in the collection and so gives its valuable insight into the contents of the Augustan libraries.",2008
"Jaeger, Paul T.; Bertot, John Carlo; McClure, Charles R.; Langa, Lesley A.",The policy implications of Internet connectivity in public libraries,GOVERNMENT INFORMATION QUARTERLY,,"The provision of public Internet access and related networked services by public libraries is affected by a number of information policy issues. This article analyzes the policy dimensions of Internet connectivity in public libraries in light of the data and findings from a national survey of public libraries conducted by the authors of this article. After providing a summary of the study methodology and findings, this article examines key policy issues that include the nature of sufficient bandwidth and broadband, the perpetuation of the digital divide of Internet access in libraries, the role of libraries as e-government access points, the complexities of funding Internet access, the impacts and contradictions of filtering, and the chilling effect of homeland security legislation in public libraries. This article concludes with a discussion of how examining these policy issues can lead to a better understanding of public libraries and the Internet access they offer within the context of public policy. (c) 2005 Published by Elsevier Inc.",2006
"Park, Sung Jae",Measuring public library accessibility: A case study using GIS,LIBRARY & INFORMATION SCIENCE RESEARCH,,"Physical accessibility is considered a fundamental measure of freedom to attend activities. Although several accessibility analyses have been conducted of public libraries, these studies tend to measure the distance from the users' homes to the library using straight lines. This generally serves as a poor measurement of actual travel distances. In order to provide more realistic analysis, and measure patterns of library access more accurately, this study employed geographic information systems (GIS), including descriptive and statistical analyses, and a road network-based distance measure. One finding from the GIS analyses was that distance was a determining factor for library use. Specifically, the evidence shows that distance affected a considerable number of registered users who lived within the areas that were defined through Thiessen polygons. Another finding was that there was a difference in the travel distance between ethnic groups: Caucasians went further to access public libraries than other ethnic groups. Finally, in terms of the relationship between distance and demographic data, household characteristics relative to children and education level were significantly related to the travel distance of users. To improve the accessibility of public libraries, this study recommends librarians define service areas for libraries, develop library programs and services for susceptible user groups, and evaluate user groups' needs. (C) 2011 Elsevier Inc. All rights reserved.",2012
"Smith, C; Logsden, K; Clark, M",Consumer health information services at Iowa City Public Library,LIBRARY TRENDS,,"IOWA CITY PUBLIC LIBRARY RECENTLY COMPLETED an eighteen-month consumer health project entitled Expanding Access to Consumer Health Electronic Resources in Iowa City and Rural Johnson County, Iowa. This project included health-related computer classes, demonstrations, and programs and was funded by the National Library of Medicine through a subcontract with the National Network of Libraries of Medicine, Greater Midwest Region. The Iowa City Public Library project built on the work completed by the Iowa Consumer Health Information Project, an earlier subcontract also funded by the National Library of Medicine. The Expanding Access project was an overall success. Project goals were met while patrons and staff increased knowledge and skills using electronic consumer health resources.",2005
"Mandel, Lauren H.",Toward an understanding of library patron wayfinding: Observing patrons' entry routes in a public library,LIBRARY & INFORMATION SCIENCE RESEARCH,,"The public library facility design literature identifies the importance of understanding patron wayfinding behavior and designing around it, and this research is a first step toward answering that call Unobtrusive observation is conducted of library patrons' initial wayfinding behavior from the two entrances of a medium-sized public library in south Florida. Although more than 100 entry routes are observed during this study, less than a quarter of those routes are taken by over 75% of observed patrons as they enter the facility, indicating that certain entry routes are extremely popular. Library personnel can use geographic information systems (GIS) to map the most popular routes Then they can use information about which entry routes are most popular to increase the level of wayfinding case in the entry areas of the facility and to strategically market library materials and services along highly-trafficked entry routes (C) 2010 Elsevier Inc All rights reserved",2010
"Schneider, TM",The regional campus library and service to the public,JOURNAL OF ACADEMIC LIBRARIANSHIP,,This article draws attention to regional campus libraries and the role they play on campus and in their larger community. Many of these libraries provide services to the public but have not recognized the public in a statement defining the library. Such a connection needs to be made.,2001
"Bertot, John Carlo; McClure, Charles R.",Asisessing sufficiency and quality of bandwidth for public libraries,INFORMATION TECHNOLOGY AND LIBRARIES,,"Based on data collected as part of the 2006 Public Libraries and the Internet study, the authors assess the degree to which public libraries provide sufficient and quality bandwidth to support the library's networked services and resources. The topic is complex due to the arbitrary assignment of a number of kilobytes per second (kbps) used to define bandwidth. Such arbitrary definitions to describe bandwidth sufficiency and quality are not useful. Public libraries are indeed connected to the Internet and do provide public-access services and resources. It is, however, time to move beyond connectivity type and speed questions and consider issues of bandwidth sufficiency, quality, and the range of networked services that should be available to the public from public libraries. A secondary but important issue is the extent to which libraries, particularly in rural areas, have access to broadband telecommunications services.",2007
"Bernfeld, BA",Developing a team management structure in a public library,LIBRARY TRENDS,,"WHILE MUCH OF THE DEVELOPMENT of learning organizations within libraries has taken place in large academic institutions, Peter Senge's theoretical concepts are just as valuable in public libraries, even comparatively small rural libraries. Utilizing the University of Arizona Library as a case study, a prototype of an organizational structure based on teams has been developed for the Teton County Library in Jackson Hole, Wyoming. This article includes a blueprint for a nonhierarchical, circular team management structure and describes the function, relationship, authority, and accountability of the library's teams, as well as a vision for leadership. It also provides a model of teamwork incorporating Senge's five disciplines into a single process that facilitates organizational learning.",2004
"Jumonville, Florence M.",Interested in Public Libraries: J. O. Modisette and the Contributions of a Louisiana Library Commissioner,INFORMATION & CULTURE,,"J. O. Modisette (1881-1942), a small-town Louisiana attorney, was interested in public libraries and resolute that every Louisianian deserved the opportunity to read. As a longtime member of the Louisiana Library Commission, Modisette supported the library cause by doing the commission's legal work, seeking grant funding, and publicizing the commission-all free of charge. This biographical sketch examines the role of a library trustee during a formative period of library development and illustrates Modisette's productive collaboration with the library community to place libraries within reach of all the people of Louisiana.",2013
"Real, Brian; Bertot, John Carlo; Jaeger, Paul T.",Rural Public Libraries and Digital Inclusion: Issues and Challenges,INFORMATION TECHNOLOGY AND LIBRARIES,,"Rural public libraries have been relatively understudied when compared to public libraries as a whole. Data are available to show that rural libraries lag behind their urban and suburban counterparts in technology service offerings, but the full meaning and effect of such disparities is unclear. The authors combine data from the Public Library Technology and Access Study with data from smaller studies to provide greater insight to these issues. By filtering these data through the digital inclusion framework, it becomes clear that disparities between rural and nonrural libraries are not merely a problem of weaker technological infrastructure. Instead, rural libraries cannot reach their full customer service potential because of lower staffing (but not lower staff dedication) and funding mechanisms that rely primarily on local monies. The authors suggest possible solutions to these disparities while also discussing the barriers that must be overcome before such solutions can be implemented.",2014
"Weldon, S",Collaboration and marketing ensure public and medical library viability,LIBRARY TRENDS,,"THE INCREASED DEMAND FOR CONSUMER HEALTH INFORMATION over the past twenty years has inspired many to usurp the job of the librarian. Health professionals are writing articles about the provision of health information for their patients. Newspaper and magazine articles tout the importance of health information companies as the means through which the public can pay for access to health information. Hospital libraries are closing at a rapid rate throughout the United States, with hospital administrators citing lack of funding as the reason and viewing the medical library as a drain on the hospital bottom line. Collaboration and marketing are two elements that ensure the library remains viable in the eyes of health professionals, hospital administrators, and the public. As librarians, we have collaborated with each other for years with tremendous results. Now is the time to publish these successes in the professional literature of health administrators and professionals and in newspapers and popular journals. Now is the time for the public and health professionals alike to realize the contributions librarians have made and are making on the consumer health front.",2005
"Jones, Elisabeth","The Public Library Movement, the Digital Library Movement, and the Large-Scale Digitization Initiative: Assumptions, Intentions, and the Role of the Public",INFORMATION & CULTURE,,"This article compares and contrasts the assumptions and motivations behind the American public library movement in the nineteenth century to the assumptions and motivations behind the digital library movement of the 1990s and early 2000s. It suggests that although the motivations between these two initiatives were starkly different, their motivations dovetail within the more recent phenomenon of large-scale digitization of the sort pursued by the Google Books Library Project and the Internet Archive. The article also interrogates the role of the public (or lack thereof) in the initial shaping of all three phenomena: public libraries, digital libraries, and large-scale digitization initiatives.",2017
"Horton, Jalesia",Senior Citizens in the Twenty-First-Century Public Library,PUBLIC LIBRARY QUARTERLY,Mobile library; outreach; senior citizens; technology; third agers,"As the popularity of public libraries continually grows, they are becoming the hub of the community. With this, each library has to constantly provide services, materials, and space catered to each category of patron. While many focus their efforts on children and teens, older adults are becoming a much more significant division with the patron population. This paper discusses the information needs of all senior citizens, specifically when paired with today's public library, as well as many of the resources public libraries have put into place, in order to deliver the materials, accessibility, outreach, and workshops needed.",2019
"McCook, KD; Barber, P","Public policy as a factor influencing adult lifelong learning, adult literacy and public libraries",REFERENCE & USER SERVICES QUARTERLY,,Public policies affecting the funding for adult lifelong learning and adult literacy through public libraries have created a framework for service that may be dissonant with the ideals of the transformational value of reading. This article reviews the current context for librarianship and adult lifelong learning and literacy programs in light of federal legislation. Ethical dilemmas of the work first ideology are presented. The librarian's capacity to foster an attitude of creation and recreation is presented. The role of education for librarianship in preparing graduates to understand the philosophical context of work with adult lifelong learners is addressed.,2002
"Gathegi, JN",The public library as a public forum: The (DE)evolution of a legal doctrine,LIBRARY QUARTERLY,,"When dealing with First Amendment free speech issues in the context of public libraries, courts have merely cited the supposition that constitutional public forum analysis leads to the conclusion that the public library is a limited public forum for the purposes of First Amendment analysis. By focusing narrowly on the issue of whether Internet access in libraries constitutes a public forum, and determining that it does not, the U.S. Supreme Court not only misses an opportunity to refine the concept of the public forum in modern-day terms but also somehow implies that public library activities are different from other speech activities and are subject to the managerial authority of the government. This article makes the argument that a redefinition of the public forum doctrine would bring tinder its ambit the public library, to join the traditional public forums such as streets, sidewalks, and parks-a departure from the current designation of the public library as a limited public forum. This article also examines the extent to which the Internet represents an expansion of the forum, whether public or limited. The argument is structured within the framework of the decision in the case of United States v. American Library Association.",2005
"Totolo, Angelina; Renken, Jaco; Sey, Araba",The Impact of Public Access Venue Information and Communication Technologies in Botswana Public Libraries,EVIDENCE BASED LIBRARY AND INFORMATION PRACTICE,,"Objective - A study on the impact of Public Access Venue (PAV) Information and Communication Technologies (ICTs) was conducted in Botswana libraries with Internet connections. The main objective was to determine the impact of ICTs in public libraries. Methods - Using the Sustainable Livelihoods Framework as a theoretical lens, the study used semi-structured interviews and focus group discussions to investigate the impact of PAV ICTs in 4 study sites, resulting in data from a total of 39 interviews and 4 focus groups. Methods - Using the Sustainable Livelihoods Framework as a theoretical lens, the study used semi-structured interviews and focus group discussions to investigate the impact of PAV ICTs in 4 study sites, resulting in data from a total of 39 interviews and 4 focus groups. Results - The results of the study show that PAV ICTs had a positive impact on users in the areas of education and economic benefits. Within educational and economic impacts, social benefits were also found, pertaining to the use of social media and the Internet for formal and informal communication. The study also revealed a slight difference between school going users and non-school going elderly users where the use and acquisition of computer skills was concerned. Elderly non-school going users tended to rely on venue staff for skills more than the younger school going users. Conclusion - The study recommends that PAV facilities should be improved in terms of skills offered and resources availed so as to appeal to both the younger school going generation and the older non-school going users. It is also recommended that education on ICT be improved to help curb rising unemployment in Botswana; such skills would enhance the income generation skills of the unemployed users as well as school leavers.",2015
"Fox, Robert E., Jr.; Keisling, Bruce L.","Build Your Program by Building Your Team: Inclusively Transforming Services, Staffing and Spaces",JOURNAL OF LIBRARY ADMINISTRATION,academic libraries; change management; assessment; stakeholder engagement; participation; reorganization; public services; library spaces,"User feedback told the story of the largest and busiest campus library being dated in both physical form and programmatic function. Under the framework of a newly-developed strategic plan, library leadership initiated a comprehensive and inclusive assessment program to understand fully user needs by engaging users, campus partners, and, importantly, library personnel. Simultaneously, they embarked on a review of change management literature for guidance on implementing the required transformation. Informed by the change management philosophy of John Kotter, the library utilized the findings of the assessment program to craft and implement a sustainable transformation of its services, staffing, and spaces.",2016
"Hapel, Rolf",Library Education - Bracing for the Future?,BIBLIOTHEK FORSCHUNG UND PRAXIS,Community engagement; library activism; public participation; co-creation; library education; information science education,"Over the last three decades, the societal changes caused by digitization have been monumental and libraries in many countries are among the institutions that were affected from the beginning. In this changing landscape of globally and rapidly evolving information technologies and upcoming social media with an abundance of readily and easily available information and data. This buffet is delivered through increasingly developed broad band networks, soon via 5G, so with the intense fight for attention by all information providers and mediators, it is no wonder that many libraries have engaged in change processes that are profoundly transforming library services, programs, organization, spatial layout, and the job content of library staff. A general movement away from libraries as transactional, book-and-collection focused institutions towards relational user and community focused organizations has been evident in this period. Not all libraries have taken a proactive stance to the change; a more reactive and reluctant approach to the societal and technological changes is not entirely uncommon, still, no library has been unaffected by the development. And the societal changes are continuing relentlessly as are the persistent speculations in and outside the library sector about the future of libraries. These societal changes and the transformation in library practices raise the question whether these changes are duly reflected in the library and information science education. This article examines the processes that have led to this ongoing transformation and discusses the choices we as library professionals are facing.",2020
"Jaeger, Paul T.; Sarin, Lindsay C.",The Politically Engaged Public Library: Admitting and Embracing the Political Nature of Libraries and Their Goals,PUBLIC LIBRARY QUARTERLY,Buildings; censorship; computer education; disabled community; early childhood education; LGBTQ community; libraries; marketing to build library support; politics; research and publication; social justice; women,"The authors of this article contend that politics is an integral part of public library leadership. Most of the work that public librarians do is designed to build citizenship knowledge and improve some aspect of social justice. Politics is a library imperative because a heavy percentage of institutional funding is tied to public funding, which is a major part of total library financial support. Political considerations, therefore, are a major concern in acquiring and retaining funding that will bring libraries and their constituents to a brighter future.",2016
