author,title,publisher,keyword,abs,publish_year
"Kunkel, Rebecca",Law Libraries and the Future of Public Access to Born-Digital Government Information,LAW LIBRARY JOURNAL,,"As government publications have shifted from print to electronic, mechanisms for guaranteeing the public's right to access government information have not kept pace. Because legal resources are among the publications most at risk of loss, law libraries should participate in efforts to ensure that born-digital government information remains freely available to all.",2017
"Stine, William F.",Does state aid stimulate public library expenditures? Evidence from Pennsylvania's enhancement program,LIBRARY QUARTERLY,,"Pennsylvania public libraries began receiving increased allotments of state aid in 2000. In the first two years of enhancement aid, total state aid received by Pennsylvania libraries more than doubled. This reversed the trend of little growth in the years preceding 2000. The enhancement aid program also redesigned certain categories of state aid to increase incentives for local government support. Based on the principles from the economics of grants literature, an empirical model was employed to test the effect of state aid on library expenditures in Pennsylvania counties. Grant response was estimated by employing two separate equations in which library expenditures and state aid were simultaneously determined. It was found that expenditure response was significantly higher in the first two years of enhancement aid than it had been previously. Further, state aid stimulated increased local revenue financing in most years and in most counties. However, the degree of stimulation decreased in many counties during the enhancement period, thus providing them with tax relief.",2006
"Robinson, Tracy",Overcoming Social Exclusion in Public Library Services to LGBTQ and Gender Variant Youth,PUBLIC LIBRARY QUARTERLY,Advocacy; community building; inclusion; LGBT people; LGBT youth; queer theory; queer youth; social exclusion; youth services,"This article addresses the vital need to meet LGBTQ information needs in public library efforts. It outlines the lack of LIS research presented on the subject, the effects of excluding this involuntary, often invisible, patron minority, and the service realms in which exclusion currently persists. After articulating the library service issues, some suggestions for improved practices are summarized, in an effort to move toward more inclusive public library communities.",2016
"McCracken, P",A comparison of print and electronic journal holdings in academic and public libraries,LIBRI,,"The past few years have seen an enormous growth in the number of journals that libraries can access electronically This is a well-researched and well-documented phenomenon, but no studies have compared the actual number of electronic journals a library can access, particularly in comparison with the total number of journals they receive through all sources, including print. The growth of serials management companies suggests the possibility of this research. Through analysis of resources tracked by Serials Solutions, Inc., one can get a firm grasp on how many electronic journals a library is tracking, in comparison with the number of print or microfilm titles they have. This article presents the first comprehensive analysis of how many journals public and various types of academic libraries can access electronically, rather than in print. While highlighting the incredible increase in access to information electronically, it also identifies the limitations of the current research, particularly regarding libraries' print holdings. As data collection improves, future research will be more accurate, and will provide a basis for studying both the growth of electronic access to journals and the expected reduction in print access to journals.",2003
"Holt, GE; Elliott, D",Measuring outcomes: Applying cost-benefit analysis to middle-sized and smaller public libraries,LIBRARY TRENDS,,"THE RECENT DEMAND FOR MORE ACCOUNTABILITY from public libraries has made it essential that true cost-benefit analysis be applied to their operations. With funding from the Public Library Association, the authors developed a cost-benefit analysis methodology and applied it to five large public library systems. The present article describes their ongoing research to modify their methodologies to make them viable for application to public libraries of much smaller size.",2003
"Williamson, Stuart",Public Library Computer Waiting Queues: Alternatives to the First-Come-First-Served Strategy,INFORMATION TECHNOLOGY AND LIBRARIES,,"This paper summarizes the results of a simulation of alternative queuing strategies for a public library computer sign-up system. Using computer usage data gathered from a public library, the performance of these various queuing strategies is compared in terms of the distribution of user wait times. The consequences of partitioning a pool of public computers are illustrated as are the potential benefits of prioritizing users in the waiting queue according to the amount of computer time they desire.",2012
"Harmon, Mark G.; Grzybowski, Shannon; Thompson, Bryan; Cross, Stephanie",Remaking the Public Law Library into a Twenty-First Century Legal Resource Center,LAW LIBRARY JOURNAL,,"This article reviews the current operations of Multnomah County, Oregon's public law library and assesses the feasibility of creating a legal resource and self-help center within the library. The article reviews common governance models of law libraries and common self-help models, supplemented by interviews with key stakeholders. We conclude that the county could greatly benefit from a self-help center and make recommendations of best practices.",2018
"Smith, Catherine Arnott; Eschenfelder, Kristin",Public Libraries in an Age of Financial Complexity: Toward Enhancing Community Financial Literacy,LIBRARY QUARTERLY,,"This report describes several linked empirical studies that examine the activities of public libraries in increasing the financial literacy of their service population. A qualitative field study examines librarians'' perceptions of the challenges in offering information and services in this domain; a second set of interviews centers on the perceptions of six partners, individuals and organizations that work with libraries to offer programs and services. Next, we report the results of a survey of the financial literacy programs and services offered by a sample of public libraries, including the priority audiences and topics of those programs and services. Finally, we discuss an analysis of the finance-related hyperlinks contained on a sample of public library websites. We discuss the implications of our findings for public librarians as well as the organizations that produce content designed to improve financial literacy. Only by understanding the reasons why these gaps in financial literacy exist can we hope to address the problem.",2013
"Buschman, John",The Library in the Life of the Public: Implications of a Neoliberal Age,LIBRARY QUARTERLY,,"Wayne Wiegand consistently put forward the research agenda of the library in the life of the user. A focus on libraries' publics is a useful variation: What, now, is the library in the life of its public(s)? In order to undertake this analysis, some practical definition of libraries' public(s) must be clarified, and how they might have changed in recent (neoliberal) times. With this background in place, an analysis of how publics now approach libraries is possible-and clarifies library responses within our current neoliberal environment.",2017
"Hicks, Deborah; Cavanagh, Mary F.; VanScoy, Amy",Social network analysis: A methodological approach for understanding public libraries and their communities,LIBRARY & INFORMATION SCIENCE RESEARCH,,"Social network analysis (SNA) as theoretical framework and quantitatively oriented methodology offers public libraries and public library researchers an as-yet unexplored way into their big data stories based on these library connections with their community. SNA offers library and information science researchers a methodology, and suggests a new research agenda, to better envision the relationships public libraries have with their communities both in-person and online by exploring the kinds of ties they have, how these ties lead to relationships, and how these relationships can be characterized. The quantitative orientation of SNA combined with its methods of data analysis in the forms of networks and hubs could give libraries the hard data they are so often in need of to demonstrate their value to their political leaders, and could uncover new directions in library use and library relationships.",2020
"Malone, Cheryl Knott",Unannounced and unexpected: The desegregation of Houston public library in the early 1950s,LIBRARY TRENDS,,"Houston Public Library operated as a racially segregated system until 1953, when it quietly changed its policy to one of token integration. Occurring some seven years before the Houston Independent School District began to desegregate, the public library's policy change depended on a few key individuals. Drawing on the library's records of discussions and events, this article traces the history of a major shift in philosophy and practice at a large urban public library in the U.S. South.",2007
"Mendez, R",Hanging indents and the reference librarian: Offering productivity software in the public library,INFORMATION TECHNOLOGY AND LIBRARIES,,"This article explores ways to expand the public library's mission, and that of the reference librarian, to include offering word processing on public access computers. The author defines access to and the ability to use word processing software as a form of literacy and links this to the library's established role in promoting literacy. This article also provides anecdotal information about introducing this software at a public library system.",2002
"Fultz, Michael",Black public libraries in the South in the era of de jure segregation,LIBRARIES & THE CULTURAL RECORD,,"The intent of this article is to present an overview and analysis of the development of public libraries for African Americans in the South during the era of dejure segregation and through the civil rights movement of the 1960s. Written from the perspective of an educational historian, the essay seeks to discern salient continuities and discontinuities in the growth and desegregation of both public libraries and public schools in the South and within this broadened context to push both fields beyond the topical blinders that have too often characterized their separate historical investigations.",2006
"Riehman-Murphy, Christina; Mross, Emily",Where the private meets the public: Results of a survey of library professionals' observed student use of academic library spaces for prayer,COLLEGE & UNDERGRADUATE LIBRARIES,Academic libraries; meditation; prayer spaces; spirituality; students,"Reports of college students using the library for spiritual practices, including prayer and meditation, consist mainly of anecdotal observations, news stories, or press releases about the creation of such spaces within academic libraries. Driven by their own experiences with students using library spaces for prayer, the authors examined how prevalent this was across US academic institutions. Using a large-scale national survey, this study found library professionals observe a wide range of student prayer behavior in a variety of library spaces, regardless of institutional or campus demographics. The results provide academic libraries with evidence to support accommodating students' spiritual needs in library spaces.",2019
"Parker, Josie Barnes",In the Public Interest,JOURNAL OF LIBRARY ADMINISTRATION,management; administrator; failure; job fatigue; horses; libraries; public; governance; social media,"We hear often of the success of managers and administrators. We can find lists of titles on how to succeed as a manager and be the best we can be. We rarely read of failure or coping with failure from the people who have failed and survived with their jobs, or not survived as so often is the case. Somewhere in between always succeeding and sometimes failing is job fatigue. What to do with ourselves and how to recover our confidence and energy when we are completely drained is a personal decision and one with many choices. The author chose learning to ride and own horses and in this column she explains how learning to mean it with horses allowed her to redefine success and remain an enthusiastic library administrator.",2016
"Austin, Jeanie",Restorative justice as a tool to address the role of policing and incarceration in the lives of youth in the United States,JOURNAL OF LIBRARIANSHIP AND INFORMATION SCIENCE,LGBTQ youth; public libraries; restorative justice; youth of color; youth services,"Disciplinary practices utilized in public libraries in the United States carry echoes of the ways in which youth of color and/or LGBTQ and gender non- conforming youth are policed and incarcerated. This research includes interviews with librarians and staff engaging in relational disciplinary practices, namely restorative justice, to gain understanding of how altering approaches to discipline may create cultural shifts that lead to more culturally conscious services to youth made vulnerable by the state. Individual, open-ended interviews with librarians and staff at an urban library system in California addressed the implementation of restorative justice practices, individuals' approaches and understandings of restorative justice, and the process of institutionalizing restorative justice throughout the library system. This research reveals that restorative justice offers one approach to creating social change through increased access to library services and resources.",2020
"Sin, Sei-Ching Joanna; Kim, Kyung-Sun",Use and non-use of public libraries in the information age: A logistic regression analysis of household characteristics and library services variables,LIBRARY & INFORMATION SCIENCE RESEARCH,,"For public libraries to achieve effective strategic planning, they must know who uses the public library and who does not use it. This study examines the characteristics of users and non-users of the public libraries using socio-demographic data from the Current Population Survey, a nationally representative survey of over 50,000 households conducted during October 13-19, 2002, and library services data from the Public Libraries Survey 2002. The study finds 34 variables to be significant. These variables including factors that have not often been studied, such as distance from the library. age/school attendance status, use of other types of library, and public library expenditure per state capita. It is also worth noting that disadvantaged groups, including ethnic minorities, recent immigrants, and people with disabilities, were less likely to use public libraries. This was true even after other factors such as education and income were held constant. The study provides a national-level assessment of the under-served populations. It also offers triangulation to other existing research, particularly qualitative information behavior studies of specific groups. (c) 2008 Elsevier Inc. All rights reserved.",2008
"Guajardo, Salomon Alcocer",Special District Libraries and Operating Costs: An Application of Data Envelopment Analysis (DEA) with Discretionary and Non-Discretionary Inputs,JOURNAL OF LIBRARY ADMINISTRATION,data envelopment analysis; economic outcomes; public library; special district; technical efficiency,"Data envelopment analysis (DEA) was used to assess the technical efficiency of special district libraries in the United States with respect to three cost-related outputs: operating cost per hour, program costs per visit, and program costs per attendance. A set of discretionary and non-discretionary inputs were used to obtain the technical efficiency scores of 999 special district libraries. The DEA input-oriented analysis shows that 30% of the libraries were technically efficient with respect to the use of the inputs to achieve their level of operating costs in 2015. The DEA analysis also shows that inefficient libraries need to make proportional reductions in the level of discretionary inputs to become technically efficient.",2018
"Matthews, Joseph R.",Management frameworks and the broader perspective,PUBLIC LIBRARY QUARTERLY,Public libraries; performance measures; goodness; management frameworks; efficiency; effectiveness; logic model,The development of management frameworks over time is reviewed as a management framework provides an effective way to help communicate the value of the public library. The use of a Logic Model is recommended as a management framework that will resonate with most funding decision makers.,2018
"Fjeldsted, Steve",Mrs. Santa Claus Thwarts the Bank Robber at the Library: True Fiction,PUBLIC LIBRARY QUARTERLY,Madera County Public Library; problem patron; Mrs. Santa Claus; bank robber,"Rarely if ever do Mrs. Santa Claus and a hardened bank robber enter a public library almost simultaneously, but when they do in the Madera Library of California during the 1990s, the career criminal encounters the redeeming power of joyful innocence and holiday cheer in the form of a dedicated children's room storytelling volunteer.",2018
"Ignatow, Gabe; Webb, Sarah M.; Poulin, Michelle; Parajuli, Ramesh; Fleming, Peter; Batra, Shika; Neupane, Diptee",Public Libraries and Democratization in Three Developing Countries: Exploring the Role of Social Capital,LIBRI-INTERNATIONAL JOURNAL OF LIBRARIES AND INFORMATION STUDIES,,"Investments in public libraries in developing countries have been made based on the idea that libraries contribute to societal democratization. Yet scholarly understanding of the relationships between public libraries and democratization is sharply limited. In this article we review historical studies of national public library systems that cast doubt on widely held assumptions that a positive relationship necessarily pertains between the establishment of public libraries and democracy. Based on this historical review and on sociological theories of social capital (e.g. Bourdieu 1986), we develop a theoretical framework intended to facilitate systematic investigation of the contributions public libraries may make to democracy. Using comparative historical and ethnographic methods, we analyze the relationship between public libraries and democratic systems of government in Namibia, Nepal, and Malawi, and find that in all three cases public libraries were established mainly during democratic regimes. However, they were not necessarily established by democratically elected governments directly, but rather because democratic regimes proved to be relatively open to the influence of diasporas and global civil society. We only find evidence of public libraries contributing to societal democratization, as we conceptualize the process, in Nepal and to a limited degree Namibia countries that lack a long-established, empowered elite class. We discuss possible implications of our analysis for library scholarship and its relations to theories of development.",2012
"Stauffer, Suzanne M.",In their own image: The public library collection as a reflection of its donors,LIBRARIES & THE CULTURAL RECORD,,"Early library boards espoused the positive effects of socially beneficial and culturally substantive knowledge. The Ogden (Utah) Carnegie Free Library board was no exception. However, when the library opened in 1903, it included a large number of donated materials that reflected a library mission beyond education and self-improvement. Ogden's community and social leaders, many of whom were library board members, donated a wide range of material, creating a public library that responded to and reflected the community's needs and interests, not merely those expressed in public statements and official documents. This information yields insights into the donors' views of the broad role of the public library in the community as well as their desire to establish an individual, ethnic, religious, and political presence in the communal institution of the library.",2007
"Bonnici, Laurie J.; Ma, Jinxuan",Public Library Engagement in Diffusing a Planned Community Health Initiative: A Dual Case Study,PUBLIC LIBRARY QUARTERLY,Community health initiative; library community engagement; informational support; information diffusion; information nudge,"Social determinants of health beckon partnerships to empower citizens to make healthy choices. This dual case study explores the roles of public library engagement in a planned community health initiative known as the Blue Zones (BZ) project. Two cases were examined through interviews, facility environmental scans, and passive footprinting. Results indicate a potential library role in promotion and support for community health initiatives. Findings reveal a need to increase librarians' awareness of social responsibilities beyond perceived professional boundaries, proactively collaborating with community agencies, and promoting community health initiatives through enhanced information access.",2019
"Visser, Marijke; Ball, Mary Alice",The Middle Mile: The Role of the Public Library in Ensuring Access to Broadband,INFORMATION TECHNOLOGY AND LIBRARIES,,"This paper discusses the role of the public library in ensuring access to the broadband communication that is so critical in today's knowledge-based society. It examines the culture of information in 2010, and then asks what it means if individuals are online or not. The paper also explores current issues surrounding telecommunications and policy, and finally seeks to understand the role of the library in this highly technological, perpetually connected world.",2010
"Copeland, Andrea J.; Barreau, Deborah",Helping People to Manage and Share Their Digital Information: A Role for Public Libraries,LIBRARY TRENDS,,"As As a cultural institution, the public library is charged with providing resources and services that fit the needs of a particular community and, if space and budgets allow, of serving as a resource and repository of the community's past. To fulfill its mission to the public, the library must attract that public by offering materials and providing opportunities for them to pursue their unique and varied interests and discover new things. By engaging individuals in the identification and preservation of their own personal, digital objects, it may be possible to increase awareness in, and commitment to, community repositories that reflect a community's diversity and that will serve all. A user education program that focuses on the importance of identifying and preserving the information and artifacts that are important, that addresses the technical aspects of preservation, and that creates awareness of the benefits and challenges associated with sharing personal information can result in a community repository that ultimately has more value for both the individual and the community.",2011
"Panchyshyn, Roman S.; Lambert, Frank P.; McCutcheon, Sevim",Resource Description and Access Adoption and Implementation in Public Libraries in the United States,LIBRARY RESOURCES & TECHNICAL SERVICES,,"This study surveyed the current state of knowledge about, and application or use of, Resource Description and Access (RDA) among American public library catalogers. In 2017, an online survey request was e-mailed to four thousand libraries for the person or persons most responsible for cataloging to complete the questionnaire. More than three hundred libraries responded. The data expose serious concerns with RDA adoption within the public library sector. While a majority of catalogers know about RDA, their working knowledge about it differs substantially depending on whether they work in rural or urban library settings. Regardless, 22 percent of respondants still had not heard of the RDA standard until completing this survey. While further training and educational opportunities (along with funds) for catalogers nationwide would help minimize this disparity, LIS schools also can play a role by educating more thoroughly the next generations of catalogers in this newer descriptive standard. Coming on the brink of a shift in the theoretical framework of the RDA standard, from the Functional Requirements for Bibliographic Records (FRBR) model to the IFLA Library Reference Model (LRM), public library catalogers risk falling even farther behind in their knowledge and compitency with the RDA standard.",2019
"Fitzpatrick, Elizabeth B.",The public library as instrument of colonialism: The case of the Netherlands East Indies,LIBRARIES & THE CULTURAL RECORD,,"Between 1918 and 1926, fully 2,500 public libraries were established by the government of the Netherlands East Indies colony, mostly in towns and villages throughout the huge archipelago that became present-day Indonesia. Though popular with newly literate local people, the material in the libraries was designed to inculcate Western values and further the colonial Situation. I will describe the historical and literary setting of this phenomenon. My analysis includes a close reading of remarks made by one of the responsible agency's longtime directors.",2008
