author,title,publisher,keyword,abs,publish_year
"Buschman, John","Public Libraries Are Doing Just Fine, Thank You: It's the Public in Public Libraries That is Threatened",CANADIAN JOURNAL OF INFORMATION AND LIBRARY SCIENCE-REVUE CANADIENNE DES SCIENCES DE L INFORMATION ET DE BIBLIOTHECONOMIE,neoliberalism; public goods; public libraries; libraries; public libraries' support,"Public libraries have been rhetorically cast as being in crisis for decades as an outmoded, unaffordable institution in high-profile venues. However, when challenged as such, public libraries are vigorously defended, and an abundance of data on their actual popularity, usage, and value is deployed. We come to the question of why this mode of questioning persists despite the manifest value that the public places on public libraries. This article proposes a two-track answer by exploring (1) the long running context of neoliberalism and corrective to our understanding of it and (2) the status of publicness within neoliberalism. The article unpacks the concept of public and how it has changed and come under specific threat-informed by our more robust understanding of neoliberalism-over the last several decades. Data and arguments about public libraries and improved quality of life, community, cultural heritage, economic assistance during hard times, or their role as third places do not necessarily fall on deaf ears, but, to deploy a metaphor, those ears have been reengineered not to hear or value them.",2020
"Barclay, Donald A.",Space and the Social Worth of Public Libraries,PUBLIC LIBRARY QUARTERLY,Public libraries; library space; public library visits; value of public libraries,"In spite of the growth of digital information and the resultant questioning by some of the value of public libraries, library usage data indicate there were 497,600,000 more visits to public libraries in 2013 than in 1993. Why do people still visit public libraries in the digital age? While many factors drive people to visit public libraries, one thing that public libraries offer that cannot be duplicated online is physical space. Over the decades, library space has been the glue holding the library universe together even as the specific activities that take inside libraries have evolved. While public libraries do an excellent job of promoting their important role in providing access to information, educational resources, technology, and a host of valuable services, they must also promote the value of public library space itself. This requires more than trotting out numbers; it requires telling compelling stories of how public library space is used and reminding the public that the kind of spaces public libraries provide are, in fact, a vanishing resource. The post-911 tightening of security in public buildings of all sorts-coupled with the increasing privatization of what were once public spaces-has left public libraries as perhaps the last remaining indoor public spaces where an individual can remain from opening until closing without needing any reason to be there and without having to spend any money. Public libraries should promote the uniqueness of their spaces in much the same way that National Parks promote the unique spaces they preserve and make available to the public.",2017
"Widdersheim, Michael M.; Koizumi, Masanori",Conceptual modelling of the public sphere in public libraries,JOURNAL OF DOCUMENTATION,Public libraries; Politics; Public sphere; Library systems; Communication; Modelling,"Purpose - The purpose of this paper is to construct a conceptual model of the public sphere in public libraries. Various international authors over the past 20 years have associated the public sphere with public libraries, but these associations have yet to be clarified and synthesized in a comprehensive way. Design/methodology/approach - This study used qualitative content analysis to identify the dimensions of the public sphere in public libraries. The study's scope included annual reports from an urban US public library system from 1900 to 2010. Findings - Six dimensions of the public sphere in public libraries are described with examples. The dimensions are: core criteria; internal public sphere; external public sphere; collect and organize discourse; perform legitimation processes; and facilitate discourse. Three of these dimensions are newly identified. The six total dimensions are synthesized into a comprehensive conceptual model with three discourse arenas: governance and management; legitimation; and commons. Originality/value - This study is distinctive because it used a data-based, empirical approach to public libraries to an abstract sociological concept. Three dimensions of the model are new to library studies literature and therefore represent new potential areas of inquiry. The resulting conceptual model is useful for both practitioners and researchers in the public library sector. Further, the model contributes to existing social and political theory.",2016
"Jordan, Mary Wilkins",Competencies for public library managers: diversity in practice,LIBRARY MANAGEMENT,Leadership; Management; Public library; Public libraries; Competency development; Competencies,"Purpose - The purpose of this paper is to identify competencies in common across public library managers. Design/methodology/approach - The request for public library managers to participate in this survey was posted to the public listserve. Participants were asked about the tasks they do regularly, to identify the skills currently seen as most important in their work. They were then given a list of competencies, and asked to identify those they felt were most important for current public library managers, for those in future managers. Findings - Some commonalities emerged, but there was not a substantial amount of overlap between skills identified by directors and non-director managers as important now or into the future. Research limitations/implications - Further research into managerial competencies focussed on specific job titles is necessary to see what kinds of skills each may value. Likewise, a broader look at public library managers may provide a better set of common competencies that will be useful for both training and hiring. Practical implications - Understanding strategies for managerial competencies will be useful in building successful training programs. Social implications - Learning in this study that it will be challenging to carry out training relevant to all types of public library managers is useful; instead it can be tailored to different levels of managers for more success. Originality/value - This is an original study, building on other work the author has carried out. The value is in understanding the real needs of managers, not just anecdotal stories.",2015
"Fischer, Rachel K.",Human resource challenges for public libraries: survey results,PUBLIC LIBRARY QUARTERLY,Public library management; human resource management; public libraries; surveys,"This essay presents the major findings from a survey about human resource management in public libraries. The survey was conducted in October 2016 via the Internet. The participants were librarians with human resource management experience employed by public libraries in the United States. The majority of the participants responded that human resource management was challenging to some degree. While a majority were able to solve their human resource problems successfully, a majority of the respondents believed that the human resource curriculum for library science programs was inadequate.",2018
"Sikes, Scott",Rural Public Library Outreach Services and Elder Users: A Case Study of the Washington County (VA) Public Library,PUBLIC LIBRARY QUARTERLY,Rural public libraries; library outreach; elder users,"Outreach services provided by rural public libraries are crucial to fulfilling their mission to provide information access to the widest array of user groups. Particular socioeconomic and geographic factors in rural areas present challenges of access to information resources, yet there exists only a limited amount of published scholarly work examining outreach services provided specifically by rural public libraries. This case study of outreach services to elder users offers contextual evidence for the centrality of social equity and access to the larger work of rural public libraries. Primary data were collected through four semi-structured focus group meetings conducted with elder users of the agency's outreach services as well as through narrative interviews with six agency staff members. Principal findings showed that elder users had particular information needs related to entertainment and intellectual stimulation, challenges of transportation, and a limited access to technology and internet service. WCPL outreach services were found to positively impact the lives and general well-being of elder users by providing vital social and community connections and serving as a key link for elder users to an institution understood to be central to the life of the community in general.",2020
"Hoppenfeld, Jared; Malafi, Elizabeth",Engaging with entrepreneurs in academic and public libraries,REFERENCE SERVICES REVIEW,Academic libraries; Business; Library services; Public libraries; Entrepreneurship; Library resources,"Purpose - The purpose of this paper is to explore how academic and public libraries support entrepreneurial researchers and, in doing so, demonstrate impact and share best practices. Design/methodology/approach - The authors discuss their own experiences as academic and public business librarians who support entrepreneurs. They do so by revealing the main services they provide to this unique user group and presenting examples from their own institutions. They also present what is done at other libraries by way of a literature review and an informal survey. Findings - After navigating the landscape of business librarian support of entrepreneurs, many commonalities were found among the types of support offered. Most libraries in this study collaborate with a business incubator, center for entrepreneurship, office of economic development or small business development center in some fashion. Numerous outreach and networking efforts were found that had positive effects on the local and national economies. Although public and academic libraries have different base user groups, both types of libraries serve current and potential entrepreneurs, as well as students, who are looking for similar data in the same kinds of resources. Originality/value - Although specific examples can be found in the literature, little has been published that provides an overview of the entrepreneurial services and resources provided at numerous libraries of different types as well as resulting impact. This paper fills this gap and should provide new ideas to librarians of all kinds wishing to reach entrepreneurs.",2015
"Maciel Filho, Adalberto Rego",Social capital and Public Library: empirical studies,PERSPECTIVAS EM CIENCIA DA INFORMACAO,Social capital; Public Library; Public policies,"Empirical research articles are herein discussed concerning / analyzing the relationship between social capital and public libraries. The work reinforces the role of basic activities (core) of public libraries and to a lesser degree, the non-core in the process of creating social capital. It also investigates the influence of the social capital in quantity demanded of community library services. Suggestions are made for public policy to include the library as a protagonist in local/community development projects.",2010
"Flaherty, Mary Grace; Kaplan, Samantha Jan",Health information: print materials assessment in public libraries,REFERENCE SERVICES REVIEW,Public health; Public libraries; Information services; Health information; Assessment; Library materials,"Purpose - The purpose this study was to determine currency of print health materials readily available in North Carolina public libraries, through a statewide assessment. Two subject areas were examined: health reference and diabetes. Design/methodology/approach - In total, 30 randomly selected public libraries were visited and unobtrusive stacks assessments were completed. Some months later, the libraries' websites were examined for collection development policies, and online catalogs were searched using the keyword diabetes to identify possible discrepancies and additions. Findings - For visits, publication dates for reference books ranged from 1899-2014 and the average number of holdings was 10 (range 0-30). The most common reference item, the AMA Family Medical Guide (2005), was available in 6 of 30 libraries. In diabetes collections, publication dates ranged from 1983-2013; the average number of books was nine (range 0-26). The Atkins Diabetes Revolution (2004) was the most common, available in 9 of 30 libraries. Two-thirds of libraries did not have a collection development policy online. Catalog searches revealed 10 titles prior to 1983 and 18 titles (non-cook books) from 2014-2016. Practical implications - The study found overall that print health reference books were outdated. In diabetes collections, there were also many outdated items. It appears that regular weeding to assure currency of print health literature is not taking place. Originality/value - The study demonstrates that public libraries may not be providing optimal print health information. With unprecedented access, it is imperative that librarians in all types of settings aid in health literacy promotion by assuring access to reliable and timely health information.",2016
"Cottrill, Julia; Letelier, Fernando; Andrade Blanco, Pablo; Garcia, Henry; Chiranov, Marcel; Tkachuk, Yuliya; Liubyva, Tetiana; Crocker, Rachel; Vanderwerff, Matthew; Cistoviene, Giedre; Krauls-Ward, Ineta; Stratilatovas, Eugenijus; Mount, Dan; Kurutyte, Agniete; Triyono",From impact to advocacy: working together toward public library sustainability,PERFORMANCE MEASUREMENT AND METRICS,Sustainability; Impact; EU; Public libraries; Advocacy; Public library sustainability,"Purpose - The purpose of this paper is to outline the Bill & Melinda Gates Foundation's Global Libraries (GLs) initiative approach to advocacy and how it informs, guides, and integrates impact data to support sustainability of GL program results. Design/methodology/approach - The paper defines advocacy in the context of GL, and explores the GL grant planning process, tools, and collaboration between advocacy and impact specialists. Results are demonstrated through grantee examples that illustrate a variety of approaches to library advocacy using impact data at local, country, and regional levels. Findings - The paper demonstrates the importance of identifying community needs, designing impact measures to demonstrate how libraries help to address those needs, and the variety of ways impact evidence can be used to effectively advocacy for public libraries. This basic formula can be applied to advocacy efforts ranging from a broad national policy to a small incremental change in perceptions of libraries by local decision makers. Originality/value - This paper reinforces the essential link between library impact measurement data and successful advocacy.",2015
"Lo, Patrick; Allard, Bradley; Wang, Na; Chiu, Dickson K. W.",Servant leadership theory in practice: North America's leading public libraries,JOURNAL OF LIBRARIANSHIP AND INFORMATION SCIENCE,North America; public librarianship; public libraries; public library management; servant leadership,"This study aims to understand the current North American public library directors' views and perceptions of successful library leadership in the 21st century. It was carried out based around a series of semi-structured interviews with 10 top-level directors of public libraries in the United States and Canada, which were published in the book World's Leading National, Public, Monastery and Royal Library Directors: Leadership, Management: Future of Libraries. The data collection method for this study consisted of narrative analysis of the 10 interviews utilizing Robert Greenleaf's servant leadership theory, which highlights the leader's desire to serve others first and foremost. With the current trends of increased globalization, digitization, and cultural diversity, among others, public libraries need to have leadership focused on creating shared-power environments encouraging collaboration. Analysis of these interviews showed that many of the directors' responses were quite similar to the concepts discussed in servant leadership. The library directors, through their leadership philosophies, benefited in boosting team cohesion, fostering collaboration, increasing creativity, and promoting morality-centered self-reflection amongst leaders, thereby helping their libraries gain and maintain competitive advantage, and improving the overall ethical culture of their organizations. The results of this study would be of interest to library professionals interested in management as well as LIS students who want to understand how library directors view successful traits of library leadership.",2020
"Luo, Lili",Health information programming in public libraries: a content analysis,PUBLIC LIBRARY QUARTERLY,Heath literacy; public library; library programming; outreach,"Health information programs, defined as library programs focusing on health-related topics, are an essential way for public libraries to reach out to their user communities, raising awareness of and interest in healthy lifestyle, promoting access to quality health information, and ultimately enhancing health literacy of the citizenry. This study presents a content analysis of the health information programs provided by a large urban public library system in the past year, seeking to strengthen the professional understanding of how public libraries can contribute to health literacy improvement through effective programming, and help other libraries gain insights on health information program planning and implementation.",2018
"Carrigan, Dennis","Public Libraries, Dual Constituencies, and Marketing",PUBLIC LIBRARY QUARTERLY,public libraries; marketing; constituencies; exchange; segments,"Marketing can be a powerful tool for public libraries. However, to realize marketing's potential, it must be understood. Unfortunately, Marketing is a term used by librarians to mean many different things and therefore has become confusing (Doucett 2008, 1). Replacing confusion with clarity, which is especially important if the goal of marketing is to elicit financial and other support, requires answering two questions: What is marketing, and what is required for marketing to deliver the benefits it is capable of? Answers are sought before when marketing came to mean many different things and ... become confusing.",2015
"Koizumi, Masanori; Widdersheim, Michael M.",Surpassing the business model: a public sphere approach to public library management,LIBRARY REVIEW,Library management; Systematic literature review; Shared value; Public library; Public sphere; Theoretical analysis,"Purpose - The purpose of this paper is to compare the characteristics of the public sphere with those of a shared value approach and better understand the value that public libraries can offer to management theory. Design/methodology/approach - This paper uses two methods. First, this study uses a systematic literature review to identify sources relevant to shared value and the public sphere in public libraries. Next, this study uses comparative theoretical analysis using data gathered from the systematic review to analyse the two theories. Findings - This study successfully describes the similarities and differences between shared value and the public sphere in public libraries. Originality/value - This study elucidates public library innovation from the perspectives of library management and the public sphere concept.",2016
"Arendt, Anne; Fife, Dustin",Impact of public domain resources on public libraries in the United States,JOURNAL OF LIBRARIANSHIP AND INFORMATION SCIENCE,CC0; copyright; creative commons; public domain; public libraries,"Ownership and rights issues relating to electronic resources can be a source of angst, confusion and litigation. This is due in part to the automatic copyright many individuals receive, including in the United States, upon creation of an original work. However, there are options available for relaxing these rights. One of these options is Creative Commons Zero. Essentially, Creative Commons Zero permits originators of materials of varying sorts to opt to put their creations into the public domain - waiving all copyright and intellectual rights. The ability for originators of works to place these items into the public domain affects not just that individual, but also all others who might make use of the resources or be affected by others who make use of the resources. One area likely to be both directly and indirectly impacted is libraries. After all, a public library is accessible by the public and contains a collection of materials or records kept for reference or borrowing and is generally funded from public sources. In the United States there are approximately 9225 public libraries (administrative entities) in all 50 states and the District of Columbia (US Census Bureau, 2009). Based on the above, this document researches the awareness, complexity and effects of Creative Commons Zero and related licenses on libraries as perceived by library directors and managers across the United States. In order to accomplish this, a quantitative survey was administered in an anonymous web-based format.",2015
"Macdonald, Anne Therese",Dedicated business centers in public libraries,REFERENCE SERVICES REVIEW,Entrepreneurs; Public libraries; Business reference services; Business services; Library services to business; Pubic library business centers,"Purpose - The purpose of this study is to determine whether or not a dedicated business center within a public library acts as a key success factor in a public library's services to the community entrepreneur. Design/methodology/approach - A questionnaire survey was sent to 88 public libraries with dedicated business centers, and posted to BRASS-L and BUSLIB-L, for input from public libraries without business centers. Interviews with three survey respondents and one local city official followed. Findings - Fifty-seven per cent of all respondents felt that a dedicated business center is very essential or essential to the services provided to the entrepreneurial community. The services most often offered were workshops/seminars/classes, counseling sessions by collaborative agencies and one-on-one research sessions with librarians. The majority of responding libraries collaborated with a community business agency (80 per cent). Fifty-one per cent spend between 6 and 20 hours/month on the collaboration. Research limitations/implications - Since 2007, many of the dedicated business centers in public libraries have closed or been consolidated with other sections and services of a public library. This should be further studied. Further research on librarian expertise in market and industry research is recommended. Originality/value - This study updates the business services associated with public libraries business services since the push in the late 1990s for public libraries to be more active in community economic development.",2015
"Parker, Josie Barnes",POLITICKING FOR THE PUBLIC LIBRARY,JOURNAL OF LIBRARY ADMINISTRATION,politics; power; public; libraries; rural; governance; trustees; community; facilities; library; millage; bond; campaign; politick,"In today's current political environment raising support for millage renewals, bond campaigns or even millage continuations for public libraries is affected by national politics, and a tendency towards tax aversion on principle across the country. The lessons we can learn from the governing boards of small and rural public libraries are worth raising up to a greater national consciousness. Board governance, community consciousness, and facilities management are clear and logical tools that elected boards of public libraries can use to politick for support of libraries.",2016
