author,title,publisher,keyword,abs,publish_year
"Donnelly, Francis P.",The geographic distribution of United States public libraries: An analysis of locations and service areas,JOURNAL OF LIBRARIANSHIP AND INFORMATION SCIENCE,Geographic information systems; geography; public libraries; service areas; spatial equity; United States,"This article explores the geography of public libraries in the United States. The distribution of libraries is examined using maps and spatial statistics to analyze spatial patterns. Methods for delineating and studying library service areas used in previous LIS research are modified and applied using geographic information systems to study variations in library accessibility by state and by socio-economic group at the national level. A history of library development is situated within the broader economic and demographic history of the US to provide insight to contemporary patterns, and Louis Round Wilson's Geography of Reading is used as a focal point for studying historical trends. Findings show that while national library coverage is extensive, the percentage of the population that lives in a library's geographic service area varies considerably by region and state, with Southern and Western states having lower values than Northeastern and Midwestern states.",2014
"Stauffer, Suzanne","Utilizing This New Medium of Mass Communication: The Regional Film Distribution Programme at the Cleveland Public Library, 1948-1951",LIBRARY & INFORMATION HISTORY,public libraries; motion picture; educational films; documentary films; audiovisual materials,"In 1948, the Carnegie Corporation made grants of $25,000 to the Cleveland Public Library and $15,000 to the Missouri State Library to set up three-year regional educational film distribution programmes in northern Ohio and in Missouri of 16 mm reel-to-reel motion picture films. In Cleveland, films were distributed within a consortium of ten library systems in the region; twenty library systems participated in Missouri. These successful programmes served asmodels for other library systems and lasted well into the last quarter of the twentieth century, when 16 mm reel-to-reel motion picture films in libraries were replaced with videocassettes and later DVDs and the programmes were no longer necessary. This paper explores the antecedents of the programme at the Cleveland Public Library as well as the careers of the two women, Patricia Blair and Virginia Beard, who were responsible for the design of the programme and for its success. Both became nationally recognized experts on the use of 16 mm films in public libraries and rose to national prominence in the American Library Association.",2017
"Friedman, Daniela B.; Kornegay, Vance; Tanner, Andrea; Bergeron, Caroline D.; Sisson, Diana C.; Weis, Megan A.; Patterson, Lee L.",Partnering with the Public Library for Health Care Education: An Evaluation of Affordable Care Act Messages,PUBLIC LIBRARY QUARTERLY,Advertisements; focus groups; health care law; health communication; public library; qualitative research,"Despite implementation of most of the provisions of the Affordable Care Act (ACA) by 2014, the public still has questions about the health care law. To assess the potential of using the library as a hub for ACA education, we tested existing and new culturally relevant messages about the health care law with twenty-seven community members. Participants discussed the message prototypes, including the visual components and promotional content, and provided advice to modify content and design to best reach target audiences. Future research can follow this example to engage libraries and community members in developing and evaluating culturally relevant health messages.",2016
"Overbey, Tracey A.; Dotson, Daniel S.; LaBadie, Molly Meyers",Public Libraries and Higher Education Combining Efforts to Create Quality Stem Children's Programs,PUBLIC LIBRARY QUARTERLY,Science; technology; engineering; and mathematics; STEM; STEM education programs; best practices; Ohio public libraries,"Science, Technology, Engineering, and Mathematics (STEM) fields are a major component of our society, and student success in STEM can lead to important opportunities and future careers. STEM education programs are important components to get children and youths interested in STEM fields and to instill in them STEM concepts. This article describes two successful Ohio urban STEM programs, produced as collaborations between public libraries and higher education institutions. Cleveland's Mean Green Science Machine focused on middle and high school-aged children while The Ohio State University (OSU) Science Cafe in Columbus focused on preschool and elementary school-aged children for its summer sessions. Recommendations for best practices for creating children's programming using STEM is provided.",2018
"Cahill, Maria; Joo, Soohyung; Howard, Mary; Walker, Suzanne","We've been Offering It for Years, But Why Do They Come? The Reasons Why Adults Bring Young Children to Public Library Storytimes",LIBRI-INTERNATIONAL JOURNAL OF LIBRARIES AND INFORMATION STUDIES,storytime; public library programs; children's services; survey research,"While storytime programs for preschool children are offered in nearly all public libraries in the United States, little is known about why adults choose to bring children to participate. This survey study gathered information from 346 parents and caregivers who attended storytime programs at 35 public libraries in three states. Parents and caregivers indicated child enjoyment of hearing stories and participating in activities and the opportunity for children to interact as the primary reasons for attending; however, differences in motivation to attend were noted by community density, relationship to the child, educational level of the adult, and length of attendance. In addition to identifying those aspects of storytimes that resonate most for children and building upon them, librarians should integrate cooperative activities that facilitate interaction. Further, librarians should take stock of their own contexts and modify programs to best address the needs of their specific community.",2020
"Yoo-Lee, EunYoung; Rhodes, Tamara; Peterson, Gabriel M.",Hispanics and public libraries Assessing their health information seeking behaviors in the e-health environment,REFERENCE SERVICES REVIEW,User studies; Public libraries; Health education; Ethnic minorities; Health literacy; Information needs and uses,"Purpose - The fastest-growing and the largest minority group in the USA, Hispanics are known to have low health literacy because of their limited English proficiency (LEP) and other socio-economic and cultural factors. This paper aims to examine the health information-seeking behaviors of Hispanics in the e-health environment and their use of public libraries as a health information source/service. Design/methodology/approach - An interviewer-administered survey was conducted using a semi-structured instrument. The questionnaires inquired about Hispanics' health information needs, source use and source preference; use of the library for health information needs; and their perceptions and satisfaction about the library's consumer health information services. A total of 26 Hispanics were recruited from a Hispanic community organization, a public library and an ethnic grocery store in North Carolina. Findings - The majority of the participants are foreign born (92.3 per cent) and non-English speakers (84.6 per cent). The internet was the most frequently used source, followed by friends/family, doctors and TV. Eighty-one per cent of the participants were internet users, and most of them (71 per cent) used the internet at home. Only 23 per cent visited a public library to search the internet for health information. Some barriers to using a public library mentioned by the participants include lack of time to visit a library, lack of skills in using the library materials, transportation, LEP, lack of eligibility for a library card, etc. Social implications - The findings will be useful for libraries and state/federal health services to evaluate and develop library services suitable for the Hispanics' consumer health information needs. Originality/value - This study is one of a few studies that use an empirical study of a low health literacy ethnic population to examine the possible roles of public libraries in enhancing health literacy.",2016
"Doney, Jylisa",Library services for unaffiliated patrons at Association of Public and Land-grant Universities (APLU),JOURNAL OF ACADEMIC LIBRARIANSHIP,Association of Public and Land-grant; Universities (APLU); Academic libraries; Unaffiliated patrons; Onsite access; Borrowing privileges,"This study reviewed library websites at Association of Public and Land-grant Universities (APLU) to learn more about the services they provide to unaffiliated patrons and how they share this information. This review demonstrated that websites at land-grant libraries affirmed unaffiliated patrons' building access privileges at slightly higher rates and circulation privileges at lower rates than non-land-grant APLUs. Data also revealed that requirements and fees for library privileges varied across APLU libraries as a whole. This research is a first step in identifying how libraries at land-grants and non-land-grant APLUs compare to one another and to different types of institutions in the services they provide to unaffiliated patrons. It also continues the discussion of whether libraries, especially those at land-grant colleges and universities, have an obligation to open their spaces and collections to unaffiliated patrons.",2019
"Stenstrom, Cheryl",Decision-making experiences of public library CEOs A study exploring the roles of interpersonal influence and evidence in everyday practice,LIBRARY MANAGEMENT,Managers; Canada; Public libraries; Interpersonal influence; Evidence-based practice; Decision-making practices,"Purpose - The purpose of this paper is to explore and describe the decision-making practices of public library managers in the context of interpersonal influence and evidence-based information sources, and to investigate the relationship between models of evidence-based practice and interpersonal influence in the decision-making process of public library managers. Design/methodology/approach - Data were collected through short audio blog posts participants made about their everyday decisions and coded considering the facets of three existing evidence-based library and information practice (EBLIP) models as well as the facets of interpersonal influence. Findings - The findings show that public library CEOs decision-making behaviours reflect the use of a variety of practices from analytical to intuitive as is expected of managers in any sector; however, a stronger reliance on gathering objective information may be present than in other sectors. Seeking multiple sources of information and a tendency towards rationalism may indicate a more sophisticated approach to decision making, but be less indicative of the practices employed more broadly. A possible outcome of these tendencies may result in discordance with external partners and collaborators. Practical implications - The findings from this study may inform the work of associations, library and information science (LIS) educators, and library managers in developing strategic directions and instructional strategies within their organisations. It is also the first study to jointly examine models of interpersonal influence and evidence-based decision-making practices in any field. Originality/value - While the study of the decision-making practices of various groups is growing, little previous research has been conducted with public library managers, and none has been undertaken in Canada.",2015
"Ouligian, John Andrew",A pillar of the Youngstown community: The Public Library of Youngstown and Mahoning County engages in the Harwood practice,PUBLIC LIBRARY QUARTERLY,I Love My Library; civic engagement; community building; community development; community involvement; community oriented; strategic planning; The Harwood Institute for Public Innovation; The Public Library of Youngstown and Mahoning County; Turning Outward,"The Harwood Institute arrived in Youngstown, Ohio, in 1999; and today, over 18 years later, its teachings have made a profound effect upon the city. The Youngstown Public Library, through the leadership of Carlton Sears and Heidi Daniel, has wholeheartedly embraced the methods and ideology of the Harwood Institute, helping to reinvigorate and power a city working its way back to prosperity.",2018
"Mehra, Bharat; Bishop, Bradley Wade; Partee, Robert P., II",Information Science Professionals as Community Action Researchers to Further the Role of Rural Public Libraries in Small Business Economic Development: A Case Study of Tennessee,CANADIAN JOURNAL OF INFORMATION AND LIBRARY SCIENCE-REVUE CANADIENNE DES SCIENCES DE L INFORMATION ET DE BIBLIOTHECONOMIE,information science professionals; community action researchers; rural public libraries; small business economic development; Tennessee,The article explores how information science professionals as community action researchers and rural public libraries can support small business economic development in Tennessee that has a traditionally debilitating history and culture. It provides insights for possibly applying similar efforts to other rural areas facing difficult socio-economic and socio-cultural circumstances.,2016
"Oguz, Fatih; Holt, Michael",Library blogs and user participation: a survey about comment spam in library blogs,LIBRARY HI TECH,Academic libraries; Public libraries,"Purpose - The purpose of this research is to identify and describe the impact of comment spam in library blogs. Three research questions guided the study: current level of commenting in library blogs; librarians' perception of comment spam; and techniques used to address the comment spam problem. Design/methodology/approach - A quantitative approach is used to investigate research questions. Informal interviews were conducted with four academic and three public libraries with active blogs to develop a better understanding of the problem and then to develop an appropriate data collection instrument. Based on the feedback received from these blog administrators, a survey questionnaire was developed and then distributed online via direct e-mailing and mailing lists. A total of 108 responses were received. Findings - Regardless of the library type with which blogs were affiliated with and the size of the community they served, user participation in library blogs was very limited in terms of comments left. Over 80 percent of libraries reported receiving five or fewer comments in a given week. Comment spam was not perceived to be a major problem by blog administrators. Detection-based techniques were the most commonly used approaches to combat comment spam in library blogs. Research limitations/implications - The research focuses on the comment spam problem in blogs affiliated with libraries where the library is responsible for content published on the blog. The comment spam problem is investigated from the library blog administrator's perspective. Practical implications - Results of this study provide empirical evidence regarding level of commenting and the impact of comment spam in library blogs. The results and findings of the study can offer guidance to libraries that are reconsidering whether to allow commenting in their blogs and to those that are planning to establish a blog to reach out to their users, while keeping this online environment engaging and interactive. Originality/value - The study provides empirical evidence that level of commenting is very limited, comment spam is not regarded as an important problem, and it does not interfere with the communication process in library blogs.",2011
"Liu, YQ; Zweizig, DL",The use of national public library statistics by public library directors,LIBRARY QUARTERLY,,"U.S. national public library statistical programs have provided information on library activity for over half a century. Utilizing statistics to describe and assess the comparative operation of library activities has become a part of library tradition and has received growing attention in the past two decades from researchers, policy makers, library managers, and professionals. However, studies about how statistics are used in libraries have been scant. We conducted a survey to investigate public library directors' use of the Federal-State Cooperative System for Public Library Data (FSCS) and the Public Library Data Service (PLDS) reports. We highlight the uses directors made of statistics and the aspects of statistics that they found particularly useful. The study's results are intended to provide library administrators with insights into ways that library statistics are used in the managerial process as well as to provide national statistical program administrators with information on the characteristics and use patterns of their products.",2001
"Muir, Rebecca; Thompson, Kim M.; Qayyum, Asim",The Diversity We Seek: A Document Analysis of Diversity and Inclusion in the Australian Library and Information Sector Job Advertisements,JOURNAL OF THE AUSTRALIAN LIBRARY AND INFORMATION ASSOCIATION,Public libraries; academic libraries; libraries; inclusion; diversity; recruitment,"A finding of the 2019 Australian Library and Information Association'sWorkforce Diversity Trend Reportwas that the diversity of Australian communities has not translated to diversity in the library and information science professions. In the wake of this report, we reviewed how Australian library and information science job advertisements discuss and recruit for diversity in their organisations. Drawing from a sample of 208 job advertisements collected from 22 January to 22 February 2019 and 86 job advertisements collected during 22 January to 3 February 2018, and using qualitative and quantitative document analysis, we provide an analysis of how the wording in library and information science job advertisements can specifically invite application from diversity groups including people with a disability, LGBTIQA+, Aboriginal and Torres Strait Islanders, culturally and linguistically diverse groups, age, and by gender.",2020
"Franks, Tina P.",Career Path Movement: Perspectives About Transitioning Between Library Environments,JOURNAL OF LIBRARY ADMINISTRATION,career path; academic libraries; public libraries; special libraries,"An MLIS program prepares librarians to work in a variety of library environments since the foundations of librarianship offer universal application. Transitioning between different library environments may not be a career option for everyone; however, there are librarians who have worked in multiple library settings. Librarians who participated in a 2016 national survey were provided an opportunity to share their perspectives and experiences about career path mobility. These anonymous responses offer best practices and advice to help decide if a move is right for you and offer tips for a successful transition into a different library environment.",2019
"Perryman, Carol L.; Jeng, Ling Hwey",Changing Models of Library Education to Benefit Rural Communities,PUBLIC LIBRARY QUARTERLY,Community informatics; library education; public libraries; rural libraries,"Rural libraries whose librarians have expertise in digital literacy and a deep understanding of unique communities contribute to improving quality of life for residents. However, many library education programs do not include the development of students as future leaders of community growth. In this article we describe efforts to build on prior research in the Appalachian region. Offered by Texas Woman's University School of Library and Information Studies (TWU SLIS), a designated Hispanic-serving institution in Texas, the program extends library roles by getting librarians out into their communities, working with community leaders and residents to facilitate needed and wanted change.",2020
"Franks, Tina P.","Should I Stay or Should I Go? A Survey of Career Path Movement Within Academic, Public and Special Librarianship",JOURNAL OF LIBRARY ADMINISTRATION,career path; academic libraries; public libraries; special libraries,"Just as there are many types of library environments, the librarians working within those spaces represent a variety of experiences, job skills, and perspectives. Librarians develop these qualities through library curricula and on-the-job experience. While some librarians spend their careers in one type of library, others may travel between library environments and gain a wider range of experiences and skills. Decisions to transition between library types may be triggered by personal and professional motivators. Results of this survey confirm some librarians are actively and successfully transitioning between library environments as an alternative career path.",2017
"Martin, Jason",Workplace Engagement of Librarians and Library Staff,JOURNAL OF LIBRARY ADMINISTRATION,Workplace engagement; libraries; academic libraries; public libraries; school libraries; special libraries; library workplace,"Very little has been written about engagement in the library workplace. Engagement and burnout are two poles on the workplace behavior spectrum. Burnout can be defined as exhaustion, cynicism, and reduced efficacy in daily work. Engagement can be defined as the opposite of burnout: energy, involvement, and high efficacy. Actively engaged employees are more satisfied in their jobs, and they are more likely to innovate and move into leadership positions. This study sought to understand the level of engagement of librarians and library staff. The Utrecht Work Engagement Scale (UWES) uses 17 questions to determine an individual?s engagement in their work by measuring the three factors of vigor, dedication, and absorption. The scores (on a 0?6 scale) of participants (n?=?1100) for engagement was 4.25; vigor 4.15; dedication 4.52; and absorption 4.11. All of these scores are within the ?average? range. Analysis found differences in levels of engagement by type of library (academic, public, special, and school) and work performed (administrative responsibility and patron interaction), but the differences were small. Open-ended responses revealed the main influences on participant engagement were workload, work fit, and work expectations; recognition; culture and environment; leadership; health; and meaning.",2020
"Saunders, Laura; Corning, Sean",From Cooperation to Collaboration: Toward a Framework for Deepening Library Partnerships,JOURNAL OF LIBRARY ADMINISTRATION,Academic libraries; collaboration; partnerships; public libraries,"Librarians are encouraged to collaborate in their work, but examples in LIS literature suggests the term collaboration is applied to a range of activities that vary widely in terms of interaction, resource-sharing, cooperative planning, and cooperative service delivery. Collaboration has been studied in other fields but remains largely unexplored beyond case studies in LIS. Through a series of focus groups with librarians and a range of potential community partners, this research identified barriers to collaboration and factors that enable successful partnerships, resulting in a general framework that could act as a guide to planning and developing deep collaborations.",2020
"Weaver, Matt",Contextual metadata: faceted schemas in virtual library communities,LIBRARY HI TECH,fiction; public libraries,"Purpose - The purpose of this paper is to explore the information needs of one user group, public library fiction readers, in order to reveal a design of an online community at the local level. Examination of user-generated metadata. can reveal new approaches to information architecture. Design/methodology/approach - A literature review into behaviors of virtual communities; surveying public library readers regarding search behavior characteristics - the survey included a sample tagging exercise to determine whether public library communities could create meaningful metadata for retrieval purposes. Findings - The use of relevance as an indicator of tag quality is flawed: in a survey, public library readers tagged the novel The Da Vinci Code. The resulting collection of tags provided a richer description of the book than did the social book-related web site www.librarything.com. Tag collections can be broken down into different categories, each reflecting a different facet of the novel: character, plot, subject/topic, setting, and genre. Faceted structure to tags enables users to choose the context of the tag to the novel. Research limitations/implications - This research is relevant in the world of social networking sites, online communities, or any other such system where users generate descriptive metadata. Examination of such metadata can reveal facets, which can guide the architect/librarian in the design of a versatile architecture. Originality/value - This research resulted in a manifold design for a public-library-based online community that allowed for the full expression of users' information needs. This research introduces a faceted structure to current approaches for user-generated metadata, adding versatility to search terms.",2007
